order id,order url,items,to,date,total,shipping,shipping_refund,gift,tax,refund,payments
114-9742305-0996231,https://www.amazon.com/gp/css/order-details?orderID=114-9742305-0996231&ref=ppx_yo2ov_dt_b_fed_order_details,"Filtrete 20x25x1 AC Furnace Air Filter, MERV 11, MPR 1000, Micro Allergen Defense, 3-Month Pleated 1-Inch Electrostatic Air Cleaning Filter, 4 Pack (Actual Size 19.69 x 24.69 x 0.81 in); ",Curtis,2025-02-13,44.60,0,,,2.82,,Mastercard ending in 5795: 2025-02-13: $44.60; 
114-6435704-1544236,https://www.amazon.com/gp/css/order-details?orderID=114-6435704-1544236&ref=ppx_yo2ov_dt_b_fed_order_details,"Softsoap Liquid Hand Soap, Aquarium Series - 7.5 Fl Oz (Pack of 6); ",Curtis,2025-02-13,6.75,0,,,0.43,,Mastercard ending in 5795: 2025-02-13: $6.75; 
112-9865638-1245006,https://www.amazon.com/gp/css/order-details?orderID=112-9865638-1245006&ref=ppx_yo2ov_dt_b_fed_order_details,"OFF! Family Care Insect & Mosquito Repellent, Bug Spray Containing 15% DEET, Protects Against Mosquitoes, 4 Oz, 2 Count; ",Curtis,2025-02-13,20.49,0,,,1.30,,Mastercard ending in 5795: 2025-02-13: $20.49; 
112-0857589-7816210,https://www.amazon.com/gp/css/order-details?orderID=112-0857589-7816210&ref=ppx_yo2ov_dt_b_fed_order_details,"Yurhap Luxury Mens Robe with Hood, Ultra Cozy Fleece Bathrobe for Men, Plush Hooded Robe with Belt & 2 Pockets; ",Curtis,2025-02-13,19.20,0,,,1.21,,Amazon Visa ending in 8513: 2025-02-13: $19.20; 
112-4541945-3696228,https://www.amazon.com/gp/css/order-details?orderID=112-4541945-3696228&ref=ppx_yo2ov_dt_b_fed_order_details,"Chakir Turkish Linens Luxury Spa and Hotel Quality Premium Turkish Cotton 6-Piece Towel Set (2 x Bath Towels, 2 x Hand Towels, 2 x Washcloths); Horizon Organic Shelf-Stable 1% Low Fat Milk Boxes, 8 fl oz, 18 Pack; Lobyn Value Packs Kitchen Towel 5 Piece Linen Set 2 Towels 2 Pot Holders 1 Oven Mitt (Owl); Chakir Turkish Linens Luxury Spa and Hotel Quality Premium Cotton 6-Piece Towel Set (2 x Bath Towels, 2 x Hand Towels, 2 x Washcloths); ",Curtis,2025-02-12,146.89,0,,,7.96,,Amazon Visa ending in 8513: 2025-02-12: $146.89; 
112-0187040-0843474,https://www.amazon.com/gp/css/order-details?orderID=112-0187040-0843474&ref=ppx_yo2ov_dt_b_fed_order_details,"Abnii 100PCS Cable Clips, Adhesive Wire Clips Organizer Cord Clips Management, Cable Staples Outdoor Strong for Wall, Desk, Christmas Lights, String Lights, TV PC Ethernet Cable, Clear Small; Lahome Moroccan Trellis Washable Rug, 2x3 Kitchen Rugs for Entryway Bathroom, Non-Slip Indoor Door Mat Ultra-Thin, Small Oriental Throw Carpet for Bedroom Entry, Cream/Multi; Chakir Turkish Linens Luxury Spa and Hotel Quality Premium Turkish Cotton 6-Piece Towel Set (2 x Bath Towels, 2 x Hand Towels, 2 x Washcloths); ",Curtis,2025-02-12,107.13,2.99,,,6.77,,Amazon Visa ending in 8513: 2025-02-12: $107.13; 
112-0545133-9549051,https://www.amazon.com/gp/css/order-details?orderID=112-0545133-9549051&ref=ppx_yo2ov_dt_b_fed_order_details,"Pure Life, Purified Water, 8 Fl Oz, Plastic Bottled Water, 24 Pack; ",Curtis,2025-02-11,4.74,0,,,0,,Mastercard ending in 5795: 2025-02-11: $4.74; 
112-9232217-9454608,https://www.amazon.com/gp/css/order-details?orderID=112-9232217-9454608&ref=ppx_yo2ov_dt_b_fed_order_details,"ThermoMaven BQ03 Grill Brush Replaceable Cleaning Head, Safe Bristle-Free BBQ Cleaning Tool, Barbecue Grill Cleaner, 6 Pcs Refill, Only for BQ03; Oil Filter Wrench Adjustable Set - 2pcs, Plumbing Wrench for 4 to 6 Inches Tight Spaces Use as Jar Opener, Rubber Strap Used by Mechanics, Plumber Tools - Adjustable Straps; ThermoMaven BBQ Bristle-Free Steam Grill Brush - Safe Grill Cleaning Accessories with Scraper for Charcoal/George Foreman/Weber/Gas/Outdoor Grill; JACO ThreadPro High-Density Thread Seal Tape - 1/2"" x 100 ft. (Mega Roll) | Professional-Grade PTFE Thread Sealant (3 Pack); Gasoila Soft-Set PTFE Pipe Thread Sealant – Non-Hardening Paste for Metal & Plastic, 2 oz Tube – Reliable Leak Prevention, Drip-Resistant, Temp Range -100 to 600°F, Made in USA; ",Curtis,2025-02-10,83.83,0,,,5.31,,Amazon Visa ending in 8513: 2025-02-10: $83.83; 
113-5376204-8467432,https://www.amazon.com/gp/css/order-details?orderID=113-5376204-8467432&ref=ppx_yo2ov_dt_b_fed_order_details,"ETASOP Throw Pillows with Inserts Included 18x18, 2 Pack Velvet Decorative Pillow Covers with Inserts Farmhouse Home Decor (Teal); ",Curtis,2025-02-10,0,0,,,0,,No current charges: 2025-02-10: $0.00; 
112-8259672-3028219,https://www.amazon.com/gp/css/order-details?orderID=112-8259672-3028219&ref=ppx_yo2ov_dt_b_fed_order_details,Rumi&Shams Turkish Hand Towels for Bathroom | 2 pcs Bathroom Hand Towels | 100% Cotton Decorative Kitchen Towels | 16x35 Boho Hand Towels | Oeko-Tex Certified Aqua Hand Towels; ,Curtis,2025-02-10,40.54,0,,,2.56,,Amazon Visa ending in 8513: 2025-02-10: $40.54; 
112-5305822-3635446,https://www.amazon.com/gp/css/order-details?orderID=112-5305822-3635446&ref=ppx_yo2ov_dt_b_fed_order_details,"Nestle Coffee mate Coffee Creamer, Original, Non Dairy Powder Creamer Singles Packets, 3g Powdered Packets (Pack of 1000); ",Curtis,2025-02-10,58.25,0,,,0,,Amazon Visa ending in 8513: 2025-02-10: $58.25; 
112-5047309-9930651,https://www.amazon.com/gp/css/order-details?orderID=112-5047309-9930651&ref=ppx_yo2ov_dt_b_fed_order_details,"VulgrCo Custom Design Your Own Personalized Labels Stickers Decals Text Name Image Photo 120 Pack - Waterproof, Dishwasher Safe, Fade Resistant, UV Protected, Heat and Cold Resistant; ",Curtis,2025-02-10,36.12,0,,,2.28,,Amazon Visa ending in 8513: 2025-02-10: $36.12; 
112-2831828-4438655,https://www.amazon.com/gp/css/order-details?orderID=112-2831828-4438655&ref=ppx_yo2ov_dt_b_fed_order_details,"Power Strip Surge Protector, 5Ft Ultra Thin Flat Plug Extension Cord with Multiple Outlets, 8 Widely Outlet Extender with 4 USB Ports(2 USB C), 1080J Wall Mount for College Dorm Room Essentials Black; Safety 1st Plug Protectors, 36 Count; ",Curtis,2025-02-10,48.52,2.99,,,3.06,,Amazon Visa ending in 8513: 2025-02-10: $48.52; 
112-9760874-8002652,https://www.amazon.com/gp/css/order-details?orderID=112-9760874-8002652&ref=ppx_yo2ov_dt_b_fed_order_details,Ring Rechargeable Quick Release Battery Pack; ,Curtis,2025-02-09,30.25,0,,,1.91,,Amazon Visa ending in 8513: 2025-02-09: $30.25; 
112-3968486-0085058,https://www.amazon.com/gp/css/order-details?orderID=112-3968486-0085058&ref=ppx_yo2ov_dt_b_fed_order_details,"Ring Solar Panel (2nd Generation), 4W for Stick Up Cam, Stick Up Cam Pro, Spotlight Cam Plus, Spotlight Cam Pro - White; NestlyMoly Couch Cover for Dogs Washable, Sofa Covers for 3 Cushion Couch Sofa Pet Friendly, Boho Couch Bed Furniture Protector Topper Pads Mat for Pets Cats Proof (27.6 x 82.7 Inch, Boho Blue); ",Curtis,2025-02-09,115.26,0,,,7.28,,Amazon Visa ending in 8513: 2025-02-09: $115.26; 
112-1247381-9080247,https://www.amazon.com/gp/css/order-details?orderID=112-1247381-9080247&ref=ppx_yo2ov_dt_b_fed_order_details,"Ring Spotlight Cam Plus, Battery | Two-Way Talk, Color Night Vision, and Security Siren (2022 release) - White; ",Curtis,2025-02-09,138.76,2.99,,,8.77,,Amazon Visa ending in 8513: 2025-02-09: $138.76; 
113-4331740-1555446,https://www.amazon.com/gp/css/order-details?orderID=113-4331740-1555446&ref=ppx_yo2ov_dt_b_fed_order_details,"Glade PlugIns Refills Air Freshener, Scented and Essential Oils for Home and Bathroom, Apple Cinnamon, 3.35 Fl Oz, 5 Count; ",Curtis,2025-02-09,10.87,0,,,0.69,,Mastercard ending in 5795: 2025-02-09: $10.87; 
112-9761569-6866630,https://www.amazon.com/gp/css/order-details?orderID=112-9761569-6866630&ref=ppx_yo2ov_dt_b_fed_order_details,"Bounty Paper Towels Quick Size, White, 16 Family Rolls = 40 Regular Rolls; ",Curtis,2025-02-08,39.47,0,,,2.50,,Visa ending in 3889: 2025-02-08: $39.47; 
112-4734370-4506665,https://www.amazon.com/gp/css/order-details?orderID=112-4734370-4506665&ref=ppx_yo2ov_dt_b_fed_order_details,"Vacuum Storage Bags 7 Jumbo, Space Saver Sealer Bags, Airtight Compression Bags for Clothes, Pillows, Comforters, Blankets, Bedding; ",Curtis,2025-02-07,18.14,0,,,1.15,,Amazon Visa ending in 8513: 2025-02-07: $18.14; 
112-9885153-5905047,https://www.amazon.com/gp/css/order-details?orderID=112-9885153-5905047&ref=ppx_yo2ov_dt_b_fed_order_details,"CRFATOP Stretch Recliner Cover 4-Pieces 1 Seat Recliner Chair Slipcovers Printed Fallon Collection Slipcover Recliner Lazy Boy Furniture Protector for Living Room,11; ",Curtis,2025-02-07,25.61,0,,,1.62,,Amazon Visa ending in 8513: 2025-02-07: $25.61; 
112-6042838-3755441,https://www.amazon.com/gp/css/order-details?orderID=112-6042838-3755441&ref=ppx_yo2ov_dt_b_fed_order_details,"WiFi Password Tin Sign WiFi Network Metal Sign Flower Guest Dragonfly Wall Art Decor For Cafe Bar Office 8x12 Inch; NEWLAKE Cotton Bedspread Quilt Sets-Reversible Patchwork Coverlet Set, Boho Chic Pattern,Queen Size; ",Curtis,2025-02-07,71.50,0,,,4.52,,Amazon Visa ending in 8513: 2025-02-07: $71.50; 
112-2145426-7781034,https://www.amazon.com/gp/css/order-details?orderID=112-2145426-7781034&ref=ppx_yo2ov_dt_b_fed_order_details,"DFEO@MF Curved Bath Mat, 17.7X 56 inch Curved Bath Rug Non Slip, Microfiber Soft Absorbent Corner Shower Mat, for Quadrant Shower Cubicle and RV Shower (Grey); ",Curtis,2025-02-07,49.09,0,,,3.10,,Amazon Visa ending in 8513: 2025-02-07: $49.09; 
111-6455725-2409858,https://www.amazon.com/gp/css/order-details?orderID=111-6455725-2409858&ref=ppx_yo2ov_dt_b_fed_order_details,"Old Spice Men's Antiperspirant & Deodorant, 24/7 Lasting Freshness, Advanced Sweat & Odor Protection with Skin Conditioners, Invisible Solid, Fiji with Palm Tree Scent, 3.4 oz (Pack of 3); ",Curtis,2025-02-07,20.32,0,,,0,,Visa ending in 3889: 2025-02-07: $20.32; 
111-0179613-7018617,https://www.amazon.com/gp/css/order-details?orderID=111-0179613-7018617&ref=ppx_yo2ov_dt_b_fed_order_details,"Crest Complete Advanced Flavoridetoothpaste 5 Pack 8.2 Oz Net Wt 41 Oz,, (); ",Curtis,2025-02-07,19.23,0,,,0,,Mastercard ending in 5795: 2025-02-07: $19.23; 
111-1256346-3706611,https://www.amazon.com/gp/css/order-details?orderID=111-1256346-3706611&ref=ppx_yo2ov_dt_b_fed_order_details,Roebic K-570-Q 32-Ounce Leach And Drain Field Opener Concentrate - Environmentally Friendly and Biodegradable Solution; ,Curtis,2025-02-06,21.81,0,,,1.38,,Mastercard ending in 5795: 2025-02-06: $21.81; 
111-1588724-2031441,https://www.amazon.com/gp/css/order-details?orderID=111-1588724-2031441&ref=ppx_yo2ov_dt_b_fed_order_details,"OxiClean White Revive Laundry Whitener and Stain Remover Liquid, 50 fl oz; ",Curtis,2025-02-06,7.77,0,,,0.49,,Mastercard ending in 5795: 2025-02-06: $7.77; 
113-8686788-6715429,https://www.amazon.com/gp/css/order-details?orderID=113-8686788-6715429&ref=ppx_yo2ov_dt_b_fed_order_details,"Aveeno Daily Moisturizing Body Wash for Dry & Sensitive Skin with Prebiotic Oat, Hydrating Oat Body Wash Nourishes Dry Skin & Gently Cleanses, Light Fragrance, Sulfate-Free, 18 fl. Oz, 2 Pack; ",Curtis,2025-02-06,14.28,0,,,0.90,,Visa ending in 3889: 2025-02-06: $14.28; 
112-7719733-9576263,https://www.amazon.com/gp/css/order-details?orderID=112-7719733-9576263&ref=ppx_yo2ov_dt_b_fed_order_details,"Folgers Classic Roast Medium Roast Coffee, 72 Keurig K-Cup Pods; ",Curtis,2025-02-06,32.99,0,,,0,,Mastercard ending in 5795: 2025-02-06: $32.99; 
112-3425805-9785012,https://www.amazon.com/gp/css/order-details?orderID=112-3425805-9785012&ref=ppx_yo2ov_dt_b_fed_order_details,"DecorRack 80 Cleaning Sponges, Heavy Duty Dish Sponges, Household Cleaning, Bathroom, Car Wash - Multicolor (Pack of 80); ",Curtis,2025-02-06,25.40,0,,,1.61,,Mastercard ending in 5795: 2025-02-06: $25.40; 
112-9444217-5892250,https://www.amazon.com/gp/css/order-details?orderID=112-9444217-5892250&ref=ppx_yo2ov_dt_b_fed_order_details,"Jiva Organics Organic Whole Black Peppercorns 1 Pound - Pepper, Premium Grade for Grinder Refill; ",Curtis,2025-02-06,14.24,0,,,0,,Mastercard ending in 5795: 2025-02-06: $14.24; 
114-6665359-7750603,https://www.amazon.com/gp/css/order-details?orderID=114-6665359-7750603&ref=ppx_yo2ov_dt_b_fed_order_details,"ToughBag 42 Gallon Trash Bags, 2.5 Mil Contractor Garbage Bags (50 COUNT) Heavy Duty Black Garbage Can Liners, 38 x 48"" - Construction, Lawn, Industrial, Leaf - Made in USA; ",Curtis,2025-02-05,29.03,0,,,1.84,,Mastercard ending in 5795: 2025-02-05: $29.03; 
112-0898589-2937858,https://www.amazon.com/gp/css/order-details?orderID=112-0898589-2937858&ref=ppx_yo2ov_dt_b_fed_order_details,"N//B Sponge Individually Wrapped, Mini Sponges Wrapped Small (40Pcs); ",Curtis,2025-02-05,30.82,0,,,1.95,,Mastercard ending in 5795: 2025-02-05: $30.82; 
111-5935367-1500265,https://www.amazon.com/gp/css/order-details?orderID=111-5935367-1500265&ref=ppx_yo2ov_dt_b_fed_order_details,"VulgrCo Custom Design Your Own Personalized Labels Stickers Decals Text Name Image Photo 120 Pack - Waterproof, Dishwasher Safe, Fade Resistant, UV Protected, Heat and Cold Resistant; ",Curtis,2025-02-05,68.05,0,,,4.31,,Amazon Visa ending in 8513: 2025-02-05: $68.05; 
112-0283515-6835446,https://www.amazon.com/gp/css/order-details?orderID=112-0283515-6835446&ref=ppx_yo2ov_dt_b_fed_order_details,"It's a 10 Haircare Miracle Shampoo Plus Keratin, 10 Fl Oz; ",Curtis,2025-02-05,17.86,0,,,1.13,,Mastercard ending in 5795: 2025-02-05: $17.86; 
111-9772443-8591450,https://www.amazon.com/gp/css/order-details?orderID=111-9772443-8591450&ref=ppx_yo2ov_dt_b_fed_order_details,"Deeteck Bed Guard Rail for Toddlers - 32"" Adjustable Heights & Folding up Portable Bed Railing for Baby - Toddler Bed Rails Guard for Crib, Twin, Bunk,Full Size, Queen & King Bed; Round Disposable Gas Burner Liners (100 Pack) Aluminum Foil Burner Covers for Gas Stove - 7.5 Inch Stove Liners for Gas Burners, Foil Liners to Catch Oil, Grease, and Food Spills, Stock Your Home; LAKEMID C Shaped End Table Set of 2, Side Table for Couch, Small Sofa Table with Metal Frame, Couch Table for Small Spaces, TV Tray Table for Living Room Bedroom (Grey); PurpleEssences Set of 12 Cloth Dinner Napkins 100% Cotton 18x18 Inch - Soft Durable Washable - Ideal for Farmhouse Party Spring Summer Easter - Perfect Everyday Use Table Linen - Light Blue; SHAFA IMPEX Handmade Wooden Napkin Rings Table Decoration Ideas (Set of 12) for Party Decoration, Dinning Table, Everyday, Family Gatherings - A Great Tabletop Décor; Seliem Spring Summer Birds Blue Table Runner, Cardinal Chickadee Bluebird Branch Red Berry Kitchen Dining Table Decor, Flower Nest Egg Burlap Home Decoration Indoor Outdoor Party Supply 13 x 72 Inches; ",Curtis,2025-02-05,141.91,2.99,,,8.96,,Amazon Visa ending in 8513: 2025-02-05: $141.91; 
111-8171015-7109053,https://www.amazon.com/gp/css/order-details?orderID=111-8171015-7109053&ref=ppx_yo2ov_dt_b_fed_order_details,"ETASOP Throw Pillows with Inserts Included 18x18, 2 Pack Velvet Decorative Pillow Covers with Inserts Farmhouse Home Decor (Wine Red); Mckanti 8 Pcs Coasters for Drink with Holder, 4 Colors Absorbent Coasters for Drinks, Minimalist Cotton Woven Coaster Set for Home Decor Tabletop Protection Suitable for Kinds of Cups, 4.3 Inches.; NY Threads Women's Fleece Hooded Bathrobe Plush Long Spa Robe, Large, Pink; Cotton Linen Placemats Birds Painting Design Place Mats Home Decoration for Dinner Table,Indoor Outdoor Kitchen Table Mats Set of 6 (Bird); ETASOP Throw Pillows with Inserts Included 18x18, 2 Pack Velvet Decorative Pillow Covers with Inserts Farmhouse Home Decor (Teal); ",Curtis,2025-02-05,120.57,0,,,7.62,,Amazon Visa ending in 8513: 2025-02-05: $120.57; 
112-5464222-3341004,https://www.amazon.com/gp/css/order-details?orderID=112-5464222-3341004&ref=ppx_yo2ov_dt_b_fed_order_details,"NY Threads Mens Hooded Fleece Bathrobe Plush Long Spa Robe, Large-X-Large, Grey; Lavish Home 2-Piece Caroline Patriotic Quilt Set – Microfiber Americana Stars and Plaid Patchwork Blanket Bed Set with Sham – Home Bedding (Twin); uxcell 2 Pack Pillow Cases Soft 1800 Series Microfiber Pillowcases Set with Zipper Standard(20""x26"") Light Gray; Snuggle Sac Teal Blue Blankets 50x70,Super Soft Warm Cozy Throw Blankets for Couch, Oversized Knit Blankets Fuzzy Plush Blankets, Heather Teal, 50x70 inches; Bedsure Sherpa King Size Blanket for Bed- Fleece Soft Cozy Fuzzy Cable Blankets for Women, Thick Warm for Winter and All Seasons, Blue, 108x90 Inches; ",Curtis,2025-02-01,289.67,0,,,18.31,,Amazon Visa ending in 8513: 2025-02-01: $289.67; 
113-7436213-7395451,https://www.amazon.com/gp/css/order-details?orderID=113-7436213-7395451&ref=ppx_yo2ov_dt_b_fed_order_details,The Spice Lab Himalayan Salt - Coarse 2.2 Lb / 1 Kilo - Pink Himalayan Salt is Nutrient and Mineral Dense for Health - Gourmet Pure Crystal - Kosher & Natural Certified; ,Curtis,2025-01-31,8.09,0,,,0,,Visa ending in 3889: 2025-01-31: $8.09; 
112-9402083-5801068,https://www.amazon.com/gp/css/order-details?orderID=112-9402083-5801068&ref=ppx_yo2ov_dt_b_fed_order_details,"Command 20 lb X-Large Picture Hanging Strips, 16 Pairs White Command Strips Heavy Duty Picture Hanger; GKGG Solar Lights Outdoor Waterproof IP65, 76 LED 3 Lighting Modes Solar Spot Lights Yard Garden Landscape Pathway Solar Lights for Outside (Warm White, 4 Pack); ",Curtis,2025-01-30,43.32,2.99,,,2.74,,Amazon Visa ending in 8513: 2025-01-30: $43.32; 
112-5762614-0013041,https://www.amazon.com/gp/css/order-details?orderID=112-5762614-0013041&ref=ppx_yo2ov_dt_b_fed_order_details,"SKYFIRE 23” Tall Fibre Reinforced Concrete Birdbaths with Birds for Patio, Woodland Tree Trunk Decorative Outdoor Bird Bath for Garden，Pedestal Birdbaths for Outdoors, Garden, Patio, Lawn, Backyard; ",Curtis,2025-01-30,146.24,0,,,9.25,,Amazon Visa ending in 8513: 2025-01-30: $146.24; 
112-5551102-6905007,https://www.amazon.com/gp/css/order-details?orderID=112-5551102-6905007&ref=ppx_yo2ov_dt_b_fed_order_details,"Birds Choice AADPLAIN Bird Bath, Pedestal, Green; Amazon eero 6 mesh wifi system - Supports internet plans up to 500 Mbps, Coverage up to 4,500 sq. ft., Connect 75+ devices, 3-pack (1 router + 2 extenders); ",Curtis,2025-01-30,306.35,0,,,19.37,,Amazon Visa ending in 8513: 2025-01-30: $306.35; 
112-3713603-7877818,https://www.amazon.com/gp/css/order-details?orderID=112-3713603-7877818&ref=ppx_yo2ov_dt_b_fed_order_details,"Personalized Garden Name Signs with Stake, Custom Red Bird Metal Decor Decorative Outside, Yard Outdoor Art Gift for Mom Grandmother, Patio House Warming Gifts New Home; ",Curtis,2025-01-30,192.87,6.99,,,12.19,,Amazon Visa ending in 8513: 2025-01-30: $192.87; 
112-8321758-6264237,https://www.amazon.com/gp/css/order-details?orderID=112-8321758-6264237&ref=ppx_yo2ov_dt_b_fed_order_details,"Nostalgia Retro Stainless Steel Electric Tea And Water Kettle, 1.7 Liters, Auto-Shut Off & Boil-Dry Protection, Water Level Indicator Window, Aqua; DDJSJ Teak Kitchen Utensils,Wooden Soup Spoon Kitchenware Seasoning Scoop Dipping,Oil Dipper,Meal Rice Scoop,Natural Utensils Handcrafted Cutlery Tool (soup spoon(10.6x3.15in))…; Surge Protector Power Strip - Extension Cord with 6 AC Outlets 4 USB (2 USB-C Ports), Flat Plug with Overload Surge Protection, Wall Mount, 5ft, Outlet Extender for Home Office Dorm Room Essentials; AIDEA Acacia Wood Salad Bowl Set with 2 Wooden Hands, Large Salad Bowl with Serving Utensils, Big Mixing Bowl for Fruits, Salad, Cereal, Corn flake,Pasta 11"" Diameter x 4.5"" Height; Teak Kitchen Utensils,Colander Ladle Skimmer Scoop Kitchenware Scoop Dipping Big Wooden Rice Long Handle Natural Utensils Handcrafted Cutlery Tool (scoop dipping(11x3.15in)); ",Curtis,2025-01-30,138.87,0,,,8.78,,Amazon Visa ending in 8513: 2025-01-30: $138.87; 
114-9477211-9954619,https://www.amazon.com/gp/css/order-details?orderID=114-9477211-9954619&ref=ppx_yo2ov_dt_b_fed_order_details,Jonathan Green (10610) Black Beauty Dense Shade Grass Seed - Cool Season Lawn Seed (25 lb); ,Curtis,2025-01-30,111.52,0,,,7.05,,Mastercard ending in 5795: 2025-01-30: $111.52; 
112-2163405-9243425,https://www.amazon.com/gp/css/order-details?orderID=112-2163405-9243425&ref=ppx_yo2ov_dt_b_fed_order_details,"Bulletproof Original Medium Roast Whole Bean Coffee, 12 Ounces, 100% Arabica Coffee Sourced from Central and South America; ",Curtis,2025-01-30,13.55,0,,,0,,Mastercard ending in 5795: 2025-01-30: $13.55; 
113-0727110-4533865,https://www.amazon.com/gp/css/order-details?orderID=113-0727110-4533865&ref=ppx_yo2ov_dt_b_fed_order_details,It's A 10 Miracle Deep Conditioner Plus Keratin 5 Oz; ,Curtis,2025-01-30,17.43,0,,,1.10,,Mastercard ending in 5795: 2025-01-30: $17.43; 
112-0760025-4278619,https://www.amazon.com/gp/css/order-details?orderID=112-0760025-4278619&ref=ppx_yo2ov_dt_b_fed_order_details,"Vacplus Septic Tank Treatment - 12 Packs for 1-Year Supply, Flushable & Dissolvable Septic Tank Treatment Packets with Easy Operation, Biodegradable Septic Tank Treatment Enzymes for Wastes & Odors; ",Curtis,2025-01-29,14.40,0,,,0.91,,Mastercard ending in 5795: 2025-01-29: $14.40; 
112-6340558-6853842,https://www.amazon.com/gp/css/order-details?orderID=112-6340558-6853842&ref=ppx_yo2ov_dt_b_fed_order_details,"Kirkland Signature Hair Regrowth Treatment Minoxidil Foam for Men, 2.11 oz, 6 Count (6 Month Supply); ",Curtis,2025-01-29,65.45,0,,,0,,Visa ending in 3889: 2025-01-29: $65.45; 
113-2016768-1830638,https://www.amazon.com/gp/css/order-details?orderID=113-2016768-1830638&ref=ppx_yo2ov_dt_b_fed_order_details,"ToughBag 42 Gallon Trash Bags, 2.5 Mil Contractor Garbage Bags (50 COUNT) Heavy Duty Black Garbage Can Liners, 38 x 48"" - Construction, Lawn, Industrial, Leaf - Made in USA; ",Curtis,2025-01-29,27.21,0,,,1.72,,Mastercard ending in 5795: 2025-01-29: $27.21; 
112-8091479-1155407,https://www.amazon.com/gp/css/order-details?orderID=112-8091479-1155407&ref=ppx_yo2ov_dt_b_fed_order_details,Signs Direct Metro Wing 800 Bracket; ,Curtis,2025-01-29,42.68,0,,,2.70,,Amazon Visa ending in 8513: 2025-01-29: $42.68; 
112-7177965-6125853,https://www.amazon.com/gp/css/order-details?orderID=112-7177965-6125853&ref=ppx_yo2ov_dt_b_fed_order_details,"SmartSign Customize Your Own Green Street Sign | 6"" x 24"" Aluminum; ",Curtis,2025-01-29,59.68,0,,,3.78,,Amazon Visa ending in 8513: 2025-01-29: $59.68; 
112-3451400-4824201,https://www.amazon.com/gp/css/order-details?orderID=112-3451400-4824201&ref=ppx_yo2ov_dt_b_fed_order_details,"Royal Walk Large Umbrella for 2 Persons - 54 Inch Automatic Open, Wind Resistant, Slate Blue, Wooden Handle, Fast Drying, Strong 16 Ribs, Travel 120cm; Birds Choice AADPLAIN Bird Bath, Pedestal, Green; AOSEA Solar Garden Lights Outdoor, Solar Fairy Lights Sway by Wind, RGB Color Firefly Lights for Patio Pathway Outdoor Garden Yard Sidewalk Decoration, Gardening Gifts for Outdoor Lighting (4 Pack); ",Curtis,2025-01-29,156.88,0,,,9.91,,Amazon Visa ending in 8513: 2025-01-29: $156.88; 
112-2489569-3026627,https://www.amazon.com/gp/css/order-details?orderID=112-2489569-3026627&ref=ppx_yo2ov_dt_b_fed_order_details,"SKYFIRE 23” Tall Fibre Reinforced Concrete Birdbaths with Birds for Patio, Woodland Tree Trunk Decorative Outdoor Bird Bath for Garden，Pedestal Birdbaths for Outdoors, Garden, Patio, Lawn, Backyard; ",Curtis,2025-01-29,146.24,0,,,9.25,,Amazon Visa ending in 8513: 2025-01-29: $146.24; 
112-6868026-6198642,https://www.amazon.com/gp/css/order-details?orderID=112-6868026-6198642&ref=ppx_yo2ov_dt_b_fed_order_details,"Sink Drain Strainer, Reversible Easy Clean Mesh Sink Strainer with 304 Stainless Steel, Wokdada Revolutionary Anti-Rust Large Kitchen Sink Strainer Food Catcher for Garbage Disposal Without Clogging; ",Curtis,2025-01-29,31.98,2.99,,,2.01,,Amazon Visa ending in 8513: 2025-01-29: $31.98; 
112-9624241-4313020,https://www.amazon.com/gp/css/order-details?orderID=112-9624241-4313020&ref=ppx_yo2ov_dt_b_fed_order_details,"nomiou Grill Cover for George Foreman GGR50B and Weber Jumbo Joe Charcoal Grill 18"" Indoor and Outdoor Electric Grill,19.5"" Dia x 17.7"" H; ",Curtis,2025-01-29,11.73,0,,,0.74,,Amazon Visa ending in 8513: 2025-01-29: $11.73; 
112-5382659-6163423,https://www.amazon.com/gp/css/order-details?orderID=112-5382659-6163423&ref=ppx_yo2ov_dt_b_fed_order_details,"Energizer Weatheready Rechargeable LED Flashlight, Emergency Flashlight for Hurricane Supplies and Survival Kits, Flash Light with Convenient Plug-in Design, Pack of 3; RVLOCK Compact RV Lock Keyless Entry with Remote, Secure Camper Latch Replacement, and Durable RV Door Lock Replacement for Trailers with Patented Security Technology; ",Curtis,2025-01-29,190.20,2.99,,,12.02,,Amazon Visa ending in 8513: 2025-01-29: $190.20; 
112-6525345-1588224,https://www.amazon.com/gp/your-account/order-details/ref=oh_aui_or_o01_?ie=UTF8&orderID=112-6525345-1588224,,,2025-01-29,,,,,,,UNKNOWN; 
112-8942470-6061049,https://www.amazon.com/gp/css/order-details?orderID=112-8942470-6061049&ref=ppx_yo2ov_dt_b_fed_order_details,"Safety 1st Adhesive Magnetic Lock System, 4 Locks And 1 Key; Chai's Choice Multi Handle Dog Leash Medium (Fuchsia) | Comfortable & Stylish Heavy Duty Leash with Duraflex Material | Quick Release Metal Snap Hook | 3M Reflective Stripes for Dog Visibility; ",Curtis,2025-01-28,0,0,,27.95,1.86,,Amazon gift card balance; Rewards Points; Amazon Visa ending in 8513; 
112-7141462-1199445,https://www.amazon.com/gp/css/order-details?orderID=112-7141462-1199445&ref=ppx_yo2ov_dt_b_fed_order_details,Neater Feeder Deluxe Mess Proof Dog Bowls Elevated Medium Sized Dog – Made in USA – No Spill Raised Dog Food Bowl Stand – Stainless Steel Dog Food and Water Bowl Set – Non-Tip & Non-Skid – Bronze; Chai's Choice Padded Outdoor Leash Medium (Orange) | Comfortable & Stylish Soft Padded Handle | Quick Release Metal Snap Hook | 3M Reflective Stripes; ,Curtis,2025-01-28,40.77,2.99,,29.66,4.45,,Amazon gift card balance; Rewards Points; Amazon Visa ending in 8513; 
