order id,order url,items,to,date,total,shipping,shipping_refund,gift,tax,refund,payments
112-7761305-5931405,https://www.amazon.com/gp/css/order-details?orderID=112-7761305-5931405&ref=ppx_yo2ov_dt_b_fed_order_details,"Tide Free & Gentle Liquid Laundry Detergent, 100 Loads, 132 fl oz, Tide Laundry Detergent, Clean Laundry Detergent (Packaging May Vary); ",Curtis,2025-09-06,16.28,0,,,1.03,,Mastercard ending in 5795: 2025-09-06: $16.28; 
112-7509746-7391437,https://www.amazon.com/gp/css/order-details?orderID=112-7509746-7391437&ref=ppx_yo2ov_dt_b_fed_order_details,"Custom 7x7ft Custom Backdrop Personalized Photo Backdrop with Picture Banner for Photography, Gift for Christmas, Birthday, Wedding, Graduation, Valentine's Day (84x84in); ",Curtis,2025-09-05,34.67,9.99,,,2.19,,Mastercard ending in 5795: 2025-09-05: $34.67; 
114-8729390-2673801,https://www.amazon.com/gp/css/order-details?orderID=114-8729390-2673801&ref=ppx_yo2ov_dt_b_fed_order_details,"Pure Life Purified Water Bottles, 24 Pack - Still Bottled Water with Added Minerals for a Crisp Taste, Plastic Bottles - 8 Fl Oz; ",Curtis,2025-09-05,8.48,0,,,0,,Mastercard ending in 5795: 2025-09-05: $8.48; 
112-9037870-2600249,https://www.amazon.com/gp/css/order-details?orderID=112-9037870-2600249&ref=ppx_yo2ov_dt_b_fed_order_details,"Pure Life Purified Water Bottles, 24 Pack - Still Bottled Water with Added Minerals for a Crisp Taste, Plastic Bottles - 8 Fl Oz; ",Curtis,2025-09-05,8.48,0,,,0,,Mastercard ending in 5795: 2025-09-05: $8.48; 
114-0240365-4705864,https://www.amazon.com/gp/css/order-details?orderID=114-0240365-4705864&ref=ppx_yo2ov_dt_b_fed_order_details,"Kaytee Wild Bird Ultimate No Mess Wild Bird Food Seed For Cardinals, Finches, Chickadees, Nuthatches, Woodpeckers, Grosbeaks, Juncos and Other Colorful Songbirds, 9.75 Pound; ",Curtis,2025-09-05,36.33,0,,,0,,Mastercard ending in 5795: 2025-09-05: $36.33; 
112-4462862-2325843,https://www.amazon.com/gp/css/order-details?orderID=112-4462862-2325843&ref=ppx_yo2ov_dt_b_fed_order_details,"12"" Selfie Ring Light with 63"" Tripod Stand/Phone Holder, QEUOOIY 20W LED Circle Lights Dimmable 3000-6500K with Remote Control and Built-in Rechargeable Battery for Vlog, Makeup, YouTube, Camera; ",Curtis,2025-09-05,44.31,0,,,2.80,,Mastercard ending in 5795: 2025-09-05: $44.31; 
112-5752381-6985819,https://www.amazon.com/gp/css/order-details?orderID=112-5752381-6985819&ref=ppx_yo2ov_dt_b_fed_order_details,"Downy Free & Gentle Fabric Softener (Fabric Conditioner), 111 fl oz, 150 Loads, Hypoallergenic; ",Curtis,2025-09-05,9.93,0,,,0.63,,Mastercard ending in 5795: 2025-09-05: $9.93; 
114-9610229-0400227,https://www.amazon.com/gp/css/order-details?orderID=114-9610229-0400227&ref=ppx_yo2ov_dt_b_fed_order_details,"Ortho Orthene Fire Ant Killer1, Kills the Queen and Destroys Mounds, Begins Working in 60 minutes, 12 oz., 2-Pack; ",Curtis,2025-09-05,25.90,0,,,1.64,,Mastercard ending in 5795: 2025-09-05: $25.90; 
111-4345368-6928225,https://www.amazon.com/gp/css/order-details?orderID=111-4345368-6928225&ref=ppx_yo2ov_dt_b_fed_order_details,"Honest Kids Organic Juice Drink, Berry Berry Good Lemonade, 6.75 Fl Oz Pouches (Pack of 32); ",Curtis,2025-09-05,16.87,0,,,1.07,,Mastercard ending in 5795: 2025-09-05: $16.87; 
111-9028664-4614667,https://www.amazon.com/gp/css/order-details?orderID=111-9028664-4614667&ref=ppx_yo2ov_dt_b_fed_order_details,"Roebic K-37-Q Septic Tank Treatment: Removes Clogs, Environmentally Friendly Bacteria Enzymes, Safe for Toilets, 32 Fl Oz - Lasts 1 Year, 32 Ounces; ",Curtis,2025-09-05,8.08,0,,,0.51,,Mastercard ending in 5795: 2025-09-05: $8.08; 
113-5230414-8722602,https://www.amazon.com/gp/css/order-details?orderID=113-5230414-8722602&ref=ppx_yo2ov_dt_b_fed_order_details,"OFF! Family Care Mosquito, Tick, and Insect Repellent, Bug Spray Containing 15% DEET, Protects Against Mosquitoes, 4 Oz, 2 Count; ",Curtis,2025-09-05,20.77,0,,,1.32,,Mastercard ending in 5795: 2025-09-05: $20.77; 
114-9639946-0837819,https://www.amazon.com/gp/css/order-details?orderID=114-9639946-0837819&ref=ppx_yo2ov_dt_b_fed_order_details,"4th & Heart Original Grass-Fed Ghee, Clarified Butter, Keto, Pasture Raised, Lactose and Casein Free, Certified Paleo (32 Ounces); ",Curtis,2025-09-05,27.62,0,,,0,,Mastercard ending in 5795: 2025-09-05: $27.62; 
114-7954865-7877829,https://www.amazon.com/gp/css/order-details?orderID=114-7954865-7877829&ref=ppx_yo2ov_dt_b_fed_order_details,"Nate's Organic 100% Pure, Raw & Unfiltered Honey - USDA Certified Organic - 16oz. Squeeze Bottle; ",Curtis,2025-09-05,8.06,0,,,0,,Mastercard ending in 5795: 2025-09-05: $8.06; 
111-2916277-6905061,https://www.amazon.com/gp/css/order-details?orderID=111-2916277-6905061&ref=ppx_yo2ov_dt_b_fed_order_details,"OxiClean White Revive Laundry Whitener and Stain Remover Liquid, 50 fl oz; ",Curtis,2025-09-05,9.52,0,,,0.60,,Mastercard ending in 5795: 2025-09-05: $9.52; 
113-7152385-4694651,https://www.amazon.com/gp/css/order-details?orderID=113-7152385-4694651&ref=ppx_yo2ov_dt_b_fed_order_details,"WD-40 Specialist Corrosion Inhibitor, Long-Lasting Anti-Rust Spray, 6.5 OZ; ",Curtis,2025-09-04,15.20,0,,,0.96,,Mastercard ending in 5795: 2025-09-04: $15.20; 
111-8215099-9821003,https://www.amazon.com/gp/css/order-details?orderID=111-8215099-9821003&ref=ppx_yo2ov_dt_b_fed_order_details,"Downy Fabric Softener Liquid, Cool Cotton Scent, 111 fl oz, 150 Loads; ",Curtis,2025-09-04,10.43,0,,,0.66,,Mastercard ending in 5795: 2025-09-04: $10.43; 
111-3391460-4252267,https://www.amazon.com/gp/css/order-details?orderID=111-3391460-4252267&ref=ppx_yo2ov_dt_b_fed_order_details,"Sweet'N Low Zero Calorie Sweetener Packets, 100 Ct, Kosher & Gluten Free, Low Glycemic Index, Individual Tea and Coffee Sweetener Packets; ",Curtis,2025-09-04,2.54,0,,,0,,Mastercard ending in 5795: 2025-09-04: $2.54; 
112-8795148-5489841,https://www.amazon.com/gp/css/order-details?orderID=112-8795148-5489841&ref=ppx_yo2ov_dt_b_fed_order_details,"NEWLAKE Quilted Cotton Bed Pillowcases, Striped Jacquard Style, 2 Pieces, 20x27 Inch; ",Curtis,2025-09-04,16.00,0,,,1.01,,Mastercard ending in 5795: 2025-09-04: $16.00; 
112-2570723-3416266,https://www.amazon.com/gp/css/order-details?orderID=112-2570723-3416266&ref=ppx_yo2ov_dt_b_fed_order_details,"Veterinary Formula Clinical Care Antiseptic and Antifungal Medicated Spray for Dogs & Cats, 8 Fl Oz (1 Pack); Veterinary Formula Clinical Care Antiseptic and Antifungal Medicated Shampoo for Dogs & Cats, 16 Fl Oz – Helps Alleviate Scaly, Greasy, red Skin – Paraben, Dye, Soap-Free (1 Pack); ",Curtis,2025-09-04,19.16,0,,,1.22,,Mastercard ending in 5795: 2025-09-04: $19.16; 
113-0385477-8013063,https://www.amazon.com/gp/css/order-details?orderID=113-0385477-8013063&ref=ppx_yo2ov_dt_b_fed_order_details,"It's a 10 Haircare Miracle Shampoo Plus Keratin 33.8 Oz, Sulfate Free; ",Curtis,2025-09-03,30.42,0,,,1.92,,Mastercard ending in 5795: 2025-09-03: $30.42; 
112-7915507-3724253,https://www.amazon.com/gp/css/order-details?orderID=112-7915507-3724253&ref=ppx_yo2ov_dt_b_fed_order_details,"Pop Secret Butter Microwave Popcorn 12ct (3.2oz Bags), 38.4oz Box (Pack of 1); Glade PlugIns Refills Air Freshener, Scented and Essential Oils for Home and Bathroom, Hawaiian Breeze, 3.35 Fl Oz, 5 Count; ",Curtis,2025-08-31,17.45,0,,,0.77,,Mastercard ending in 5795: 2025-08-31: $17.45; 
113-2017330-4635411,https://www.amazon.com/gp/css/order-details?orderID=113-2017330-4635411&ref=ppx_yo2ov_dt_b_fed_order_details,"It's a 10 Haircare Miracle Shampoo Plus Keratin, 10 Fl Oz; ",Curtis,2025-08-30,17.99,0,,,1.14,,Mastercard ending in 5795: 2025-08-30: $17.99; 
113-9693043-0412226,https://www.amazon.com/gp/your-account/order-details/ref=oh_aui_or_o01_?ie=UTF8&orderID=113-9693043-0412226,,,2025-08-28,,,,,,,UNKNOWN; 
111-0947914-2181864,https://www.amazon.com/gp/css/order-details?orderID=111-0947914-2181864&ref=ppx_yo2ov_dt_b_fed_order_details,"Bulletproof Original Medium Roast Whole Bean Coffee, 12 Ounces, Clean Coffee Tested for Toxins, Packaging May Vary; ",Curtis,2025-08-28,11.04,0,,,0,,Mastercard ending in 5795: 2025-08-28: $11.04; 
113-6453769-5700234,https://www.amazon.com/gp/css/order-details?orderID=113-6453769-5700234&ref=ppx_yo2ov_dt_b_fed_order_details,"Paper Bowls, 100% Compostable Disposable Soup Bowl [125-Pack] 12 oz. Heavy Duty, Eco-Friendly, Biodegradable Bagasse Hot Food Plates and Bowls - Natural Brown (BPI Certified) (PFAS-Free); ",Curtis,2025-08-28,20.27,0,,,1.28,,Mastercard ending in 5795: 2025-08-28: $20.27; 
112-2330120-8614668,https://www.amazon.com/gp/your-account/order-details/ref=oh_aui_or_o01_?ie=UTF8&orderID=112-2330120-8614668,,,2025-08-28,,,,,,,UNKNOWN; 
111-1857820-3959442,https://www.amazon.com/gp/your-account/order-details/ref=oh_aui_or_o01_?ie=UTF8&orderID=111-1857820-3959442,,,2025-08-28,,,,,,,UNKNOWN; 
113-8708105-5736205,https://www.amazon.com/gp/your-account/order-details/ref=oh_aui_or_o01_?ie=UTF8&orderID=113-8708105-5736205,,,2025-08-28,,,,,,,UNKNOWN; 
114-2338127-5724227,https://www.amazon.com/gp/css/order-details?orderID=114-2338127-5724227&ref=ppx_yo2ov_dt_b_fed_order_details,Mane 'n Tail Original Formula For Thicker Fuller Stronger Hair 16 oz (3 pack Shampoo); ,Curtis,2025-08-28,21.29,0,,,1.35,,Mastercard ending in 5795: 2025-08-28: $21.29; 
111-0104941-2197039,https://www.amazon.com/gp/your-account/order-details/ref=oh_aui_or_o01_?ie=UTF8&orderID=111-0104941-2197039,,,2025-08-28,,,,,,,UNKNOWN; 
113-2922962-4861039,https://www.amazon.com/gp/your-account/order-details/ref=oh_aui_or_o01_?ie=UTF8&orderID=113-2922962-4861039,,,2025-08-28,,,,,,,UNKNOWN; 
112-9101328-7544240,https://www.amazon.com/gp/css/order-details?orderID=112-9101328-7544240&ref=ppx_yo2ov_dt_b_fed_order_details,Goetze's Candy Vanilla Caramel Creams - 5 Pound Bag (80 Ounces) - Fresh from the Factory; ,Curtis,2025-08-27,28.77,0,,,1.82,,Mastercard ending in 5795: 2025-08-27: $28.77; 
112-9475502-6864225,https://www.amazon.com/gp/css/order-details?orderID=112-9475502-6864225&ref=ppx_yo2ov_dt_b_fed_order_details,"Tide Free & Gentle Liquid Laundry Detergent, 100 Loads, 132 fl oz, Tide Laundry Detergent, Clean Laundry Detergent (Packaging May Vary); ",Curtis,2025-08-27,18.19,0,,,1.15,,Mastercard ending in 5795: 2025-08-27: $18.19; 
112-6228997-7944260,https://www.amazon.com/gp/css/order-details?orderID=112-6228997-7944260&ref=ppx_yo2ov_dt_b_fed_order_details,"Bounce Dryer Sheets Laundry Fabric Softener, Free & Gentle, 240 Count; Kaytee Hummingbird ElectroNectar Wild Bird Food, Ready to Use, 64 Ounces; Tide PODS Free & Gentle Laundry Detergent Soap Pacs, 102 Count, Laundry Detergent Pacs, Laundry PODS Detergent; ",Curtis,2025-08-17,58.28,0,,,3.02,,Mastercard ending in 5795: 2025-08-17: $58.28; 
112-1512462-9819402,https://www.amazon.com/gp/your-account/order-details/ref=oh_aui_or_o01_?ie=UTF8&orderID=112-1512462-9819402,,,2025-08-17,,,,,,,UNKNOWN; 
112-0238270-5137826,https://www.amazon.com/gp/css/order-details?orderID=112-0238270-5137826&ref=ppx_yo2ov_dt_b_fed_order_details,Sapphire Labs Nectar Defender - Hummingbird Nectar Extender That Prolongs The Life of Nectar for Hummingbird Feeders - It Works Exceptionally Well During Warm Weather Months - 2 Pack; ,Curtis,2025-08-13,19.16,0,,,1.21,,Mastercard ending in 5795: 2025-08-13: $19.16; 
112-7944051-2829065,https://www.amazon.com/gp/css/order-details?orderID=112-7944051-2829065&ref=ppx_yo2ov_dt_b_fed_order_details,"Hummer's Galore Hummingbird Food, Ready-to-Mix Hummingbird Nectar, All-Natural Nectar Collector Formula, No Preservatives or Dyes, Makes 192 oz (Pack of 3); ",Curtis,2025-08-13,32.99,2.99,,,0,,Visa ending in 3889: 2025-08-13: $32.99; 
111-6254744-2345803,https://www.amazon.com/gp/css/order-details?orderID=111-6254744-2345803&ref=ppx_yo2ov_dt_b_fed_order_details,"Tide PODS Free & Gentle Laundry Detergent Soap Pacs, HE Compatible, Unscented, Gentle on Skin, 76 Count, Tide PODS Laundry Detergent; ",Curtis,2025-08-10,18.12,0,,,1.15,,Mastercard ending in 5795: 2025-08-10: $18.12; 
112-7059937-0728264,https://www.amazon.com/gp/css/order-details?orderID=112-7059937-0728264&ref=ppx_yo2ov_dt_b_fed_order_details,"Finish Quantum Dishwasher Pods, No Pre-Rinse Detergent For 24HR Dried-On Stain & Grease, 82 Count; ",Curtis,2025-08-10,17.10,0,,,1.08,,Mastercard ending in 5795: 2025-08-10: $17.10; 
112-9169300-8188202,https://www.amazon.com/gp/css/order-details?orderID=112-9169300-8188202&ref=ppx_yo2ov_dt_b_fed_order_details,"Scott Rapid-Dissolving Toilet Paper, 48 Double Rolls (6 Packs of 8), Sustainable, Septic-Safe, Toilet Paper; ",Curtis,2025-08-10,66.41,0,,,4.20,,Mastercard ending in 5795: 2025-08-10: $66.41; 
112-2876469-7993811,https://www.amazon.com/gp/css/order-details?orderID=112-2876469-7993811&ref=ppx_yo2ov_dt_b_fed_order_details,"Glade PlugIns Refills Air Freshener, Scented and Essential Oils for Home and Bathroom, Hawaiian Breeze, 3.35 Fl Oz, 5 Count; ",Curtis,2025-08-10,10.87,0,,,0.69,,Mastercard ending in 5795: 2025-08-10: $10.87; 
111-0213744-8883434,https://www.amazon.com/gp/css/order-details?orderID=111-0213744-8883434&ref=ppx_yo2ov_dt_b_fed_order_details,"OxiClean Odor Blasters Versatile Odor and Stain Remover Powder, 5 lb; ",Curtis,2025-08-10,10.69,0,,,0.68,,Mastercard ending in 5795: 2025-08-10: $10.69; 
112-9391543-6045829,https://www.amazon.com/gp/css/order-details?orderID=112-9391543-6045829&ref=ppx_yo2ov_dt_b_fed_order_details,"Bounty Paper Towels Quick Size, White, 16 Family Rolls = 40 Regular Rolls; ",Curtis,2025-08-10,39.47,0,,,2.50,,Mastercard ending in 5795: 2025-08-10: $39.47; 
113-9056964-5204264,https://www.amazon.com/gp/css/order-details?orderID=113-9056964-5204264&ref=ppx_yo2ov_dt_b_fed_order_details,"Lysol Power Clean Multi-Surface Cleaner, 2x Concentrated Pour, Mango & Hibiscus, 28 Fl Oz; ",Curtis,2025-08-10,3.15,0,,,0.20,,Mastercard ending in 5795: 2025-08-10: $3.15; 
114-1333001-1690607,https://www.amazon.com/gp/css/order-details?orderID=114-1333001-1690607&ref=ppx_yo2ov_dt_b_fed_order_details,"Hefty Ultra Strong Tall Kitchen Trash Bags, Lavender & Sweet Vanilla Scent, 13 Gallon, 80 Count; ",Curtis,2025-08-10,10.86,0,,,0.69,,Mastercard ending in 5795: 2025-08-10: $10.86; 
113-8013467-0888256,https://www.amazon.com/gp/css/order-details?orderID=113-8013467-0888256&ref=ppx_yo2ov_dt_b_fed_order_details,"Bounty Paper Towels Quick Size, White, 16 Family Rolls = 40 Regular Rolls; ",Curtis,2025-08-09,39.47,0,,,2.50,,Mastercard ending in 5795: 2025-08-09: $39.47; 
111-6181480-4413033,https://www.amazon.com/gp/css/order-details?orderID=111-6181480-4413033&ref=ppx_yo2ov_dt_b_fed_order_details,"Dove Beauty Bar Soap Sensitive, 8 Bars for Sensitive Skin, Fragrance Free and Hypoallergenic 3.75 oz; ",Curtis,2025-08-09,11.76,0,,,0.74,,Mastercard ending in 5795: 2025-08-09: $11.76; 
112-0063747-2001834,https://www.amazon.com/gp/css/order-details?orderID=112-0063747-2001834&ref=ppx_yo2ov_dt_b_fed_order_details,"Glade PlugIns Refills Air Freshener, Scented and Essential Oils for Home and Bathroom, Hawaiian Breeze, 3.35 Fl Oz, 5 Count; ",Curtis,2025-08-09,10.87,0,,,0.69,,Mastercard ending in 5795: 2025-08-09: $10.87; 
112-4105239-9507447,https://www.amazon.com/gp/css/order-details?orderID=112-4105239-9507447&ref=ppx_yo2ov_dt_b_fed_order_details,"(3PCS) Dog Paw Print Stickers – Waterproof Vinyl Decals for Water Bottle, Scrapbook, Tumbler, Laptop, iPad Case – Paw Sticker for Dog & Cat Lovers – 3"" x 2.8""; ",Curtis,2025-08-08,8.53,0,,,0.54,,Mastercard ending in 5795: 2025-08-08: $8.53; 
112-0597536-0519418,https://www.amazon.com/gp/css/order-details?orderID=112-0597536-0519418&ref=ppx_yo2ov_dt_b_fed_order_details,"Pure Life Purified Water Bottles, 24 Pack - Still Bottled Water with Added Minerals for a Crisp Taste, Plastic Bottles - 8 Fl Oz; ",Curtis,2025-08-08,6.75,0,,,0,,Mastercard ending in 5795: 2025-08-08: $6.75; 
111-4396595-2969062,https://www.amazon.com/gp/css/order-details?orderID=111-4396595-2969062&ref=ppx_yo2ov_dt_b_fed_order_details,"Pompeian USDA Organic Extra Virgin Olive Oil Non-Stick Cooking Spray, No Propellant, 5 Fl Oz, Pack of 3; ",Curtis,2025-08-08,11.32,0,,,0,,Mastercard ending in 5795: 2025-08-08: $11.32; 
111-3617496-1283407,https://www.amazon.com/gp/css/order-details?orderID=111-3617496-1283407&ref=ppx_yo2ov_dt_b_fed_order_details,"McCafe Premium Roast Coffee, Keurig Single-Serve K-Cup Pods, Medium Roast, 72 Count; ",Curtis,2025-08-08,29.31,0,,,0,,Mastercard ending in 5795: 2025-08-08: $29.31; 
111-4103477-0873058,https://www.amazon.com/gp/css/order-details?orderID=111-4103477-0873058&ref=ppx_yo2ov_dt_b_fed_order_details,"Horizon Organic Shelf Stable Whole Milk Boxes, USDA Certified Organic UHT Milk from Pasture-Raised Cows, No Refrigeration Required, 8 fl oz, 18 Count; ",Curtis,2025-08-08,33.12,0,,,0,,Mastercard ending in 5795: 2025-08-08: $33.12; 
112-5969906-9157854,https://www.amazon.com/gp/css/order-details?orderID=112-5969906-9157854&ref=ppx_yo2ov_dt_b_fed_order_details,"Crave Beverages Flavored Coffee Pods Sampler, Compatible with 2.0 K-Cup Brewers, Assorted Variety Pack, 100 Count; ",Curtis,2025-08-08,33.91,0,,,0,,Mastercard ending in 5795: 2025-08-08: $33.91; 
111-7203445-3485845,https://www.amazon.com/gp/css/order-details?orderID=111-7203445-3485845&ref=ppx_yo2ov_dt_b_fed_order_details,"OFF! Family Care Insect & Mosquito Repellent, Bug Spray Containing 15% DEET, Protects Against Mosquitoes, 4 Oz, 2 Count; ",Curtis,2025-08-08,20.97,0,,,1.32,,Mastercard ending in 5795: 2025-08-08: $20.97; 
111-7843420-1851408,https://www.amazon.com/gp/css/order-details?orderID=111-7843420-1851408&ref=ppx_yo2ov_dt_b_fed_order_details,"Horizon Organic Shelf Stable Whole Milk Boxes, USDA Certified Organic UHT Milk from Pasture-Raised Cows, No Refrigeration Required, 8 fl oz, 18 Count; ",Curtis,2025-08-08,16.56,0,,,0,,Mastercard ending in 5795: 2025-08-08: $16.56; 
112-4774329-2469061,https://www.amazon.com/gp/css/order-details?orderID=112-4774329-2469061&ref=ppx_yo2ov_dt_b_fed_order_details,"Maruchan Ramen Beef, Instant Ramen Noodles, Ready to Eat Meals, 3 Oz, 24 Count; ",Curtis,2025-08-08,16.91,0,,,0,,Mastercard ending in 5795: 2025-08-08: $16.91; 
112-6057260-0890601,https://www.amazon.com/gp/css/order-details?orderID=112-6057260-0890601&ref=ppx_yo2ov_dt_b_fed_order_details,"Pompeian USDA Organic Extra Virgin Olive Oil Non-Stick Cooking Spray, No Propellant, 5 Fl Oz, Pack of 3; ",Curtis,2025-08-08,11.32,0,,,0,,Mastercard ending in 5795: 2025-08-08: $11.32; 
112-3122289-2999438,https://www.amazon.com/gp/css/order-details?orderID=112-3122289-2999438&ref=ppx_yo2ov_dt_b_fed_order_details,"Pirate's Booty Aged White Cheddar and Cheddar Blast Cheese Puffs Variety Pack, Gluten-Free, Kids Snacks, 0.5oz and 0.75oz (18ct); ",Curtis,2025-08-08,8.47,0,,,0,,Mastercard ending in 5795: 2025-08-08: $8.47; 
114-8041752-7213817,https://www.amazon.com/gp/css/order-details?orderID=114-8041752-7213817&ref=ppx_yo2ov_dt_b_fed_order_details,"Roebic K-37-Q Septic Tank Treatment: Removes Clogs, Environmentally Friendly Bacteria Enzymes, Safe for Toilets, 32 Fl Oz - Lasts 1 Year, 32 Ounces; ",Curtis,2025-08-08,8.08,0,,,0.51,,Mastercard ending in 5795: 2025-08-08: $8.08; 
111-4727015-6669037,https://www.amazon.com/gp/css/order-details?orderID=111-4727015-6669037&ref=ppx_yo2ov_dt_b_fed_order_details,"McCafe Premium Roast Coffee, Keurig Single Serve K-Cup Pods, Medium Roast, 96 Count; ",Curtis,2025-08-08,29.93,0,,,0,,Mastercard ending in 5795: 2025-08-08: $29.93; 
113-9970653-3951403,https://www.amazon.com/gp/css/order-details?orderID=113-9970653-3951403&ref=ppx_yo2ov_dt_b_fed_order_details,"Old Spice Men's Antiperspirant & Deodorant, 24/7 Lasting Freshness, Advanced Sweat & Odor Protection with Skin Conditioners, Invisible Solid, Fiji with Palm Tree Scent, 3.4 oz (Pack of 3); ",Curtis,2025-08-08,22.87,0,,,0,,Mastercard ending in 5795: 2025-08-08: $22.87; 
113-6408634-3199406,https://www.amazon.com/gp/css/order-details?orderID=113-6408634-3199406&ref=ppx_yo2ov_dt_b_fed_order_details,"Ziploc Quart Food Storage Freezer Bags, Stay Open Design, Easy to Fill, 60 count (Packaging May Vary); ",Curtis,2025-08-08,7.06,0,,,0.45,,Mastercard ending in 5795: 2025-08-08: $7.06; 
112-7665084-1903458,https://www.amazon.com/gp/css/order-details?orderID=112-7665084-1903458&ref=ppx_yo2ov_dt_b_fed_order_details,"Maruchan Ramen Chicken, Instant Ramen Noodles, Ready to Eat Meals, 3 Oz, 24 Count; ",Curtis,2025-08-08,6.53,0,,,0,,Mastercard ending in 5795: 2025-08-08: $6.53; 
111-1239487-6222615,https://www.amazon.com/gp/css/order-details?orderID=111-1239487-6222615&ref=ppx_yo2ov_dt_b_fed_order_details,"4th & Heart Original Grass-Fed Ghee, Clarified Butter, Keto, Pasture Raised, Lactose and Casein Free, Certified Paleo (32 Ounces); ",Curtis,2025-08-08,25.49,0,,,0,,Mastercard ending in 5795: 2025-08-08: $25.49; 
114-6908220-7036246,https://www.amazon.com/gp/css/order-details?orderID=114-6908220-7036246&ref=ppx_yo2ov_dt_b_fed_order_details,"Downy Free & Gentle Fabric Softener (Fabric Conditioner), 111 fl oz, 150 Loads, Hypoallergenic; ",Curtis,2025-08-07,9.93,0,,,0.63,,Mastercard ending in 5795: 2025-08-07: $9.93; 
114-7438433-8980214,https://www.amazon.com/gp/css/order-details?orderID=114-7438433-8980214&ref=ppx_yo2ov_dt_b_fed_order_details,"Community Coffee Ground Coffee Packets, Breakfast Blend Medium Roast, Pre-Measured 2.5 Ounce Individual Coffee Packets, Box of 40; ",Curtis,2025-08-07,49.29,0,,,0,,Mastercard ending in 5795: 2025-08-07: $49.29; 
113-3901048-0901034,https://www.amazon.com/gp/css/order-details?orderID=113-3901048-0901034&ref=ppx_yo2ov_dt_b_fed_order_details,"Honest Kids Organic Juice Drink, Berry Berry Good Lemonade, 6.75 Fl Oz Pouches (Pack of 32); ",Curtis,2025-08-07,16.10,0,,,1.02,,Mastercard ending in 5795: 2025-08-07: $16.10; 
114-1222637-1970616,https://www.amazon.com/gp/css/order-details?orderID=114-1222637-1970616&ref=ppx_yo2ov_dt_b_fed_order_details,"OxiClean White Revive Laundry Whitener and Stain Remover Liquid, 50 fl oz; ",Curtis,2025-08-07,9.52,0,,,0.60,,Mastercard ending in 5795: 2025-08-07: $9.52; 
112-5946316-5189827,https://www.amazon.com/gp/css/order-details?orderID=112-5946316-5189827&ref=ppx_yo2ov_dt_b_fed_order_details,"Pure Life Purified Water Bottles, 24 Pack - Still Bottled Water with Added Minerals for a Crisp Taste, Plastic Bottles - 8 Fl Oz; ",Curtis,2025-08-07,6.75,0,,,0,,Mastercard ending in 5795: 2025-08-07: $6.75; 
111-2258594-0341005,https://www.amazon.com/gp/css/order-details?orderID=111-2258594-0341005&ref=ppx_yo2ov_dt_b_fed_order_details,"Dawn Platinum Dishwashing Liquid, Fresh Rain Scent, 32.7 fl oz; ",Curtis,2025-08-07,5.92,0,,,0.37,,Mastercard ending in 5795: 2025-08-07: $5.92; 
112-2684279-4826612,https://www.amazon.com/gp/css/order-details?orderID=112-2684279-4826612&ref=ppx_yo2ov_dt_b_fed_order_details,"TV Dock Station Set for Nintendo,Switch TV Docking Station with 1080P HDMI and USB 3.0 Port for Nintendo Switch,Charging Dock Set for Switch Console (for Switch); PowerA Joy Con Comfort Grips for Nintendo Switch - Black; ",Curtis,2025-08-06,60.70,0,,,3.83,,Visa ending in 9214: 2025-08-06: $60.70; 
112-5762333-8305802,https://www.amazon.com/gp/css/order-details?orderID=112-5762333-8305802&ref=ppx_yo2ov_dt_b_fed_order_details,"Custom 7x7ft Custom Backdrop Personalized Photo Backdrop with Picture Banner for Photography, Gift for Christmas, Birthday, Wedding, Graduation, Valentine's Day (84x84in); ",Curtis,2025-08-04,35.74,9.99,,,2.26,,Mastercard ending in 5795: 2025-08-04: $35.74; 
112-5543720-4124209,https://www.amazon.com/gp/css/order-details?orderID=112-5543720-4124209&ref=ppx_yo2ov_dt_b_fed_order_details,"Finish Quantum Dishwasher Pods, No Pre-Rinse Detergent For 24HR Dried-On Stain & Grease, 82 Count; Downy Free & Gentle Fabric Softener (Fabric Conditioner), 111 fl oz, 150 Loads, Hypoallergenic; ",Curtis,2025-08-04,30.21,0,,,1.91,,Mastercard ending in 5795: 2025-08-04: $30.21; 
112-4825099-8869869,https://www.amazon.com/gp/css/order-details?orderID=112-4825099-8869869&ref=ppx_yo2ov_dt_b_fed_order_details,"It's a 10 Haircare Miracle Shampoo Plus Keratin, 10 Fl Oz; ",Curtis,2025-08-01,15.21,0,,,0.96,,Mastercard ending in 5795: 2025-08-01: $15.21; 
111-1444661-9417067,https://www.amazon.com/gp/css/order-details?orderID=111-1444661-9417067&ref=ppx_yo2ov_dt_b_fed_order_details,"N//B Sponge Individually Wrapped, Mini Sponges Wrapped Small (40Pcs); ",Curtis,2025-07-31,30.82,0,,,1.95,,Mastercard ending in 5795: 2025-07-31: $30.82; 
111-5461334-1417824,https://www.amazon.com/gp/css/order-details?orderID=111-5461334-1417824&ref=ppx_yo2ov_dt_b_fed_order_details,"Chakir Turkish Linens Luxury Spa and Hotel Quality Premium Turkish Cotton 6-Piece Towel Set (2 x Bath Towels, 2 x Hand Towels, 2 x Washcloths); ",Curtis,2025-07-31,36.50,0,,,2.31,,Mastercard ending in 5795: 2025-07-31: $36.50; 
112-2799082-6094668,https://www.amazon.com/gp/css/order-details?orderID=112-2799082-6094668&ref=ppx_yo2ov_dt_b_fed_order_details,Jonathan Green (10515) Black Beauty Heat & Drought Resistant Grass Seed - Cool Season Lawn Seed (7 lb); ,Curtis,2025-07-31,43.20,0,,,2.73,,Mastercard ending in 5795: 2025-07-31: $43.20; 
113-1193663-6852252,https://www.amazon.com/gp/css/order-details?orderID=113-1193663-6852252&ref=ppx_yo2ov_dt_b_fed_order_details,"Vacplus Septic Tank Treatment 12 Pcs for 1-Year Supply, Dissolvable Packs with Easy Operation, Durable Biodegradable Enzymes for Wastes, Greases & Odors, Brown, 3x Efficiency; ",Curtis,2025-07-31,12.23,0,,,0.77,,Mastercard ending in 5795: 2025-07-31: $12.23; 
112-1806604-1547459,https://www.amazon.com/gp/css/order-details?orderID=112-1806604-1547459&ref=ppx_yo2ov_dt_b_fed_order_details,"ToughBag 42 Gallon Trash Bags, 2.5 Mil Contractor Garbage Bags (50 COUNT) Heavy Duty Black Garbage Can Liners, 38 x 48"" - Construction, Lawn, Industrial, Leaf - Made in USA; ",Curtis,2025-07-31,32.65,0,,,2.06,,Mastercard ending in 5795: 2025-07-31: $32.65; 
